{
    "$schema": "http://json-schema.org/draft-04/schema",
    "maxProperties": 14,
    "minProperties": 14,
    "properties": {
        "buy_currency": {
            "maxLength": 5,
            "minLength": 5,
            "type": [
                "string",
                "null"
            ]
        },
        "buy_price": {
            "exclusiveMaximum": false,
            "exclusiveMinimum": false,
            "maximum": 2000,
            "minimum": 1000,
            "type": [
                "null",
                "integer"
            ]
        },
        "color_1": {
            "maxLength": 8,
            "minLength": 3,
            "type": [
                "string"
            ]
        },
        "color_2": {
            "maxLength": 8,
            "minLength": 3,
            "type": [
                "string"
            ]
        },
        "exchange_currency": {
            "maxLength": 14,
            "minLength": 4,
            "type": [
                "string",
                "null"
            ]
        },
        "exchange_price": {
            "exclusiveMaximum": false,
            "exclusiveMinimum": false,
            "maximum": 1800,
            "minimum": 4,
            "type": [
                "null",
                "integer"
            ]
        },
        "hha_points": {
            "exclusiveMaximum": false,
            "exclusiveMinimum": false,
            "maximum": 501,
            "minimum": 89,
            "type": [
                "integer"
            ]
        },
        "internal_id": {
            "exclusiveMaximum": false,
            "exclusiveMinimum": false,
            "maximum": 14707,
            "minimum": 7322,
            "type": [
                "integer"
            ]
        },
        "is_craftable": {
            "type": [
                "boolean"
            ]
        },
        "is_unlocked": {
            "type": [
                "boolean"
            ]
        },
        "name": {
            "maxLength": 27,
            "minLength": 8,
            "type": [
                "string"
            ]
        },
        "sell_currency": {
            "maxLength": 5,
            "minLength": 5,
            "type": [
                "string"
            ]
        },
        "sell_price": {
            "exclusiveMaximum": false,
            "exclusiveMinimum": false,
            "maximum": 10360,
            "minimum": 88,
            "type": [
                "integer"
            ]
        },
        "unique_entry_id": {
            "maxLength": 17,
            "minLength": 17,
            "type": [
                "string"
            ]
        }
    },
    "required": [
        "buy_currency",
        "buy_price",
        "color_1",
        "color_2",
        "exchange_currency",
        "exchange_price",
        "hha_points",
        "internal_id",
        "is_craftable",
        "is_unlocked",
        "name",
        "sell_currency",
        "sell_price",
        "unique_entry_id"
    ],
    "title": "FurnitureRug",
    "type": "object"
}
